[
  {
    "schema_version": 1,
    "signal_id": "onchain-usdc-20230311-0001",
    "source": "onchain",
    "coin": "USDC",
    "observed_at": "2023-03-11T02:00:00Z",
    "metric": "price_usd",
    "value": 0.9812,
    "meta": { "exchange": "aggregate" }
  },
  {
    "schema_version": 1,
    "signal_id": "onchain-usdc-20230311-0002",
    "source": "onchain",
    "coin": "USDC",
    "observed_at": "2023-03-11T02:00:00Z",
    "metric": "peg_deviation_bps",
    "value": -188
  },
  {
    "schema_version": 1,
    "signal_id": "offchain-usdc-20230310-0001",
    "source": "offchain",
    "coin": "USDC",
    "observed_at": "2023-03-10T23:00:00Z",
    "metric": "news_risk_flag",
    "value": 1,
    "meta": { "note": "reserve bank exposure news" }
  }
]
